<atoms xmlns="https://www.w3schools.com"
    xmlns:xsi="http://www.w3.org/2001/XMLSchema-instance"
    xsi:schemaLocation="https://www.w3schools.com tabla_periodica.xsd">
    <atom state="gas">
        <name>Iron</name>
        <symbol>ARH</symbol>
        <characteristics>
            <atomic-weight>543</atomic-weight>
            <atomic-number></atomic-number>
        </characteristics>
        <discoverer>
            <discoverer-name>Pedro</discoverer-name>
            <discoverer-first-surname>Sanchez</discoverer-first-surname>
            <discoverer-second-surname>Parera</discoverer-second-surname>
        </discoverer>
        <boiling-point units="kelvin">543</boiling-point>
        <density units="kg" />
        <origin />
    </atom>

    <atom state="liquid">
        <name>Gas</name>
        <symbol>F</symbol>
        <characteristics>
            <atomic-weight>10</atomic-weight>
            <atomic-number>6</atomic-number>
        </characteristics>
        <discoverer>
            <discoverer-name>Albert</discoverer-name>
            <discoverer-first-surname>Einstein</discoverer-first-surname>
            <discoverer-second-surname>Hernandez</discoverer-second-surname>
        </discoverer>
        <boiling-point units="centigrade">567</boiling-point>
        <origin />
    </atom>
</atoms>